{"cohort":"teen","indicator":"mh_er","years":[2022,2023,2024],"year_sets":{"2022":{"years":[2022],"weight":"ANALWT2_C1"},"2023":{"years":[2023],"weight":"ANALWT2_C1"},"2024":{"years":[2024],"weight":"ANALWT2_C1"},"all":{"years":[2022,2023,2024],"weight":"ANALWT2_C3"},"recent2":{"years":[2023,2024],"weight":"ANALWT2_C2"}},"crosses":["2022","2023","2024","all","recent2"],"cells":{"year_set":["2022","2022","2022","2022","2022","2022","2022","2022","2022","2022","2022","2022","2022","2022","2022","2022","2022","2022","2022","2022","2022","2022","2022","2022","2022","2022","2022","2022","2022","2022","2022","2022","2022","2022","2022","2022","2022","2022","2022","2022","2022","2022","2022","2022","2022","2022","2022","2022","2022","2022","2022","2022","2022","2022","2022","2022","2022","2022","2022","2022","2022","2022","2022","2022","2022","2022","2022","2022","2022","2022","2022","2022","2022","2022","2022","2022","2022","2022","2022","2022","2022","2022","2022","2022","2022","2022","2022","2022","2022","2022","2022","2022","2022","2022","2022","2022","2022","2022","2022","2022","2022","2022","2022","2022","2022","2022","2022","2022","2022","2022","2022","2022","2022","2022","2022","2022","2022","2022","2022","2022","2022","2022","2022","2022","2022","2022","2022","2022","2022","2022","2022","2022","2022","2022","2022","2022","2022","2022","2022","2022","2022","2022","2022","2022","2022","2022","2022","2022","2022","2022","2022","2022","2022","2022","2022","2022","2022","2022","2022","2022","2022","2022","2022","2022","2022","2022","2022","2022","2022","2022","2022","2022","2022","2022","2022","2022","2022","2022","2022","2022","2022","2022","2022","2022","2022","2022","2022","2022","2022","2022","2022","2022","2022","2022","2022","2022","2022","2022","2022","2022","2022","2022","2022","2022","2022","2022","2022","2022","2022","2022","2022","2022","2022","2022","2022","2022","2022","2022","2022","2022","2022","2022","2022","2022","2022","2022","2022","2022","2022","2022","2022","2022","2022","2022","2022","2022","2022","2022","2022","2022","2022","2022","2022","2022","2022","2022","2022","2022","2022","2022","2022","2022","2022","2022","2022","2022","2022","2022","2022","2022","2022","2022","2022","2022","2022","2022","2022","2022","2022","2022","2022","2022","2022","2022","2022","2022","2022","2022","2022","2022","2022","2022","2022","2022","2022","2022","2022","2022","2022","2022","2022","2022","2022","2022","2022","2022","2022","2022","2023","2023","2023","2023","2023","2023","2023","2023","2023","2023","2023","2023","2023","2023","2023","2023","2023","2023","2023","2023","2023","2023","2023","2023","2023","2023","2023","2023","2023","2023","2023","2023","2023","2023","2023","2023","2023","2023","2023","2023","2023","2023","2023","2023","2023","2023","2023","2023","2023","2023","2023","2023","2023","2023","2023","2023","2023","2023","2023","2023","2023","2023","2023","2023","2023","2023","2023","2023","2023","2023","2023","2023","2023","2023","2023","2023","2023","2023","2023","2023","2023","2023","2023","2023","2023","2023","2023","2023","2023","2023","2023","2023","2023","2023","2023","2023","2023","2023","2023","2023","2023","2023","2023","2023","2023","2023","2023","2023","2023","2023","2023","2023","2023","2023","2023","2023","2023","2023","2023","2023","2023","2023","2023","2023","2023","2023","2023","2023","2023","2023","2023","2023","2023","2023","2023","2023","2023","2023","2023","2023","2023","2023","2023","2023","2023","2023","2023","2023","2023","2023","2023","2023","2023","2023","2023","2023","2023","2023","2023","2023","2023","2023","2023","2023","2023","2023","2023","2023","2023","2023","2023","2023","2023","2023","2023","2023","2023","2023","2023","2023","2023","2023","2023","2023","2023","2023","2023","2023","2023","2023","2023","2023","2023","2023","2023","2023","2023","2023","2023","2023","2023","2023","2023","2023","2023","2023","2023","2023","2023","2023","2023","2023","2023","2023","2023","2023","2023","2023","2023","2023","2023","2023","2023","2023","2023","2023","2023","2023","2023","2023","2023","2023","2023","2023","2023","2023","2023","2023","2023","2023","2023","2023","2023","2023","2023","2023","2023","2023","2023","2023","2023","2023","2023","2023","2023","2023","2023","2023","2023","2023","2023","2023","2023","2023","2023","2023","2023","2023","2023","2023","2023","2023","2023","2023","2023","2023","2023","2023","2023","2023","2023","2023","2023","2023","2023","2023","2023","2023","2023","2023","2023","2023","2023","2023","2023","2023","2023","2023","2024","2024","2024","2024","2024","2024","2024","2024","2024","2024","2024","2024","2024","2024","2024","2024","2024","2024","2024","2024","2024","2024","2024","2024","2024","2024","2024","2024","2024","2024","2024","2024","2024","2024","2024","2024","2024","2024","2024","2024","2024","2024","2024","2024","2024","2024","2024","2024","2024","2024","2024","2024","2024","2024","2024","2024","2024","2024","2024","2024","2024","2024","2024","2024","2024","2024","2024","2024","2024","2024","2024","2024","2024","2024","2024","2024","2024","2024","2024","2024","2024","2024","2024","2024","2024","2024","2024","2024","2024","2024","2024","2024","2024","2024","2024","2024","2024","2024","2024","2024","2024","2024","2024","2024","2024","2024","2024","2024","2024","2024","2024","2024","2024","2024","2024","2024","2024","2024","2024","2024","2024","2024","2024","2024","2024","2024","2024","2024","2024","2024","2024","2024","2024","2024","2024","2024","2024","2024","2024","2024","2024","2024","2024","2024","2024","2024","2024","2024","2024","2024","2024","2024","2024","2024","2024","2024","2024","2024","2024","2024","2024","2024","2024","2024","2024","2024","2024","2024","2024","2024","2024","2024","2024","2024","2024","2024","2024","2024","2024","2024","2024","2024","2024","2024","2024","2024","2024","2024","2024","2024","2024","2024","2024","2024","2024","2024","2024","2024","2024","2024","2024","2024","2024","2024","2024","2024","2024","2024","2024","2024","2024","2024","2024","2024","2024","2024","2024","2024","2024","2024","2024","2024","2024","2024","2024","2024","2024","2024","2024","2024","2024","2024","2024","2024","2024","2024","2024","2024","2024","2024","2024","2024","2024","2024","2024","2024","2024","2024","2024","2024","2024","2024","2024","2024","2024","2024","2024","2024","2024","2024","2024","2024","2024","2024","2024","2024","2024","2024","2024","2024","2024","2024","2024","2024","2024","2024","2024","2024","2024","2024","2024","2024","2024","2024","2024","2024","2024","2024","2024","2024","2024","2024","2024","2024","2024","2024","2024","2024","all","all","all","all","all","all","all","all","all","all","all","all","all","all","all","all","all","all","all","all","all","all","all","all","all","all","all","all","all","all","all","all","all","all","all","all","all","all","all","all","all","all","all","all","all","all","all","all","all","all","all","all","all","all","all","all","all","all","all","all","all","all","all","all","all","all","all","all","all","all","all","all","all","all","all","all","all","all","all","all","all","all","all","all","all","all","all","all","all","all","all","all","all","all","all","all","all","all","all","all","all","all","all","all","all","all","all","all","all","all","all","all","all","all","all","all","all","all","all","all","all","all","all","all","all","all","all","all","all","all","all","all","all","all","all","all","all","all","all","all","all","all","all","all","all","all","all","all","all","all","all","all","all","all","all","all","all","all","all","all","all","all","all","all","all","all","all","all","all","all","all","all","all","all","all","all","all","all","all","all","all","all","all","all","all","all","all","all","all","all","all","all","all","all","all","all","all","all","all","all","all","all","all","all","all","all","all","all","all","all","all","all","all","all","all","all","all","all","all","all","all","all","all","all","all","all","all","all","all","all","all","all","all","all","all","all","all","all","all","all","all","all","all","all","all","all","all","all","all","all","all","all","all","all","all","all","all","all","all","all","all","all","all","all","all","all","all","all","all","all","all","all","all","all","all","all","all","all","all","all","all","all","all","all","all","all","all","all","all","all","all","all","all","all","all","all","all","all","recent2","recent2","recent2","recent2","recent2","recent2","recent2","recent2","recent2","recent2","recent2","recent2","recent2","recent2","recent2","recent2","recent2","recent2","recent2","recent2","recent2","recent2","recent2","recent2","recent2","recent2","recent2","recent2","recent2","recent2","recent2","recent2","recent2","recent2","recent2","recent2","recent2","recent2","recent2","recent2","recent2","recent2","recent2","recent2","recent2","recent2","recent2","recent2","recent2","recent2","recent2","recent2","recent2","recent2","recent2","recent2","recent2","recent2","recent2","recent2","recent2","recent2","recent2","recent2","recent2","recent2","recent2","recent2","recent2","recent2","recent2","recent2","recent2","recent2","recent2","recent2","recent2","recent2","recent2","recent2","recent2","recent2","recent2","recent2","recent2","recent2","recent2","recent2","recent2","recent2","recent2","recent2","recent2","recent2","recent2","recent2","recent2","recent2","recent2","recent2","recent2","recent2","recent2","recent2","recent2","recent2","recent2","recent2","recent2","recent2","recent2","recent2","recent2","recent2","recent2","recent2","recent2","recent2","recent2","recent2","recent2","recent2","recent2","recent2","recent2","recent2","recent2","recent2","recent2","recent2","recent2","recent2","recent2","recent2","recent2","recent2","recent2","recent2","recent2","recent2","recent2","recent2","recent2","recent2","recent2","recent2","recent2","recent2","recent2","recent2","recent2","recent2","recent2","recent2","recent2","recent2","